,date_of_fail,product_description,country_of_origin,producer_name,reason_for_fail,results,units,reference,food_category,test_applied,holding_order_number,category   ,result/s,category,test_applied/_reason_for_fail,results/units,results_/_units.1,result,results_in_mg_per_kg
731,2020-11-05,Legal lean syrup (cherry/raspberry),United States,Doing Big Things,St Johns Wort,,none,FSC 1.4.4,Surveillance,Composition,16501,,,,,,,,
732,2020-11-05,Legal lean syrup (cherry/raspberry),United States,Doing Big Things,Melatonin,,none,Imported Food Control Act section 3(2),Surveillance,Composition,16501,,,,,,,,
733,2020-11-09,Frozen shredded coconut,Vietnam,BJ&T Joint Stock Company,Salmonella,250.0,g,FSC 1.6.1,Surveillance,Microbiological,16502,,,,,,,,2500000.0
734,2020-11-10,Garlic shoots,China,Shandong Sinofarm Co Ltd,Carbendazim,,mg/kg,FSC 1.4.2,Surveillance,Fruit and vegetable residue screen,HO match 15454,,,,,,,,
735,2020-11-16,Watermelon flavoured bubble gum,South Africa,Mondelez South Africa Pty Ltd,Additive Erythrosine,,none,FSC 1.3.1,Surveillance,Composition,HO match 16158,,,,,,,,
736,2020-11-17,Fresh baby corn,Thailand,Exoriens Fresh Ltd,E. coli,,mpn/g,FSC 1.6.1,Surveillance,Microbiological,16524,,,,,,,,
737,2020-11-17,Munaka sultana currant,India,Jay Keshav Exports Pvt Ltd,Cyhalothrin,,mg/kg,FSC 1.4.2,Surveillance,Fruit and vegetable residue screen,16529,,,,,,,,
738,2020-11-20,Crab meat,Vietnam,Saigon Aquatic Products Trading Joint Stock Company DL769,Nitrofurazone,,mg/kg,FSC 1.4.2,Surveillance,Chemical,HO match 14468,,,,,,,,
739,2020-11-20,Frozen whole durian,Vietnam,BJ&T Joint Stock Company,Carbendazim,,mg/kg,FSC 1.4.2,Surveillance,Fruit and vegetable residue screen,16537,,,,,,,,
740,2020-11-20,Frozen whole durian,Vietnam,BJ&T Joint Stock Company,Iprodione,,mg/kg,FSC 1.4.2,Surveillance,Fruit and vegetable residue screen,16537,,,,,,,,
741,2020-11-20,Betel nut medium slices,India,Jay Keshav Exports Pvt Ltd,Areca catechu (Betel nut),,none,FSC 1.4.4,Surveillance,Composition,HO match 16079,,,,,,,,
742,2020-11-20,Mouth freshener,India,JSRJ Group Pty Ltd,Areca catechu (Betel nut),,none,FSC 1.4.4,Surveillance,Composition,16523,,,,,,,,
743,2020-11-25,Faunus - lemon syrup,Taiwan,Ming Sheng Food Enterprises Pty Ltd,Additive silicone resin,,none,FSC 1.3.2,Surveillance,Composition,16536,,,,,,,,
744,2020-11-26,Toor dal (pea),India,Patel Chaturbhai Ranchhodbhai Pulses Llp,Chlorpyrifos,,mg/kg,FSC 1.4.2,Surveillance,Fruit and vegetable residue screen,16543,,,,,,,,
745,2020-11-26,Jacob's original cream crackers,Malaysia,Kraft Malaysia Sdn Bhd,Vitamin B1,,none,FSC 1.4.2,Surveillance,Composition,16563,,,,,,,,
746,2020-11-26,Jacob's original cream crackers,Malaysia,Kraft Malaysia Sdn Bhd,Vitamin A,,none,FSC 1.4.2,Surveillance,Composition,16563,,,,,,,,
747,2020-11-26,Jacob's original cream crackers,Malaysia,Kraft Malaysia Sdn Bhd,Iodine,,none,FSC 1.4.2,Surveillance,Composition,16563,,,,,,,,
748,2020-11-24,Dried shaved bonito,Japan,Yamaki Co Ltd,Histamine,240.0,mg/kg,HIS 12/2016,Risk,Not Applied,,,,,,,,,240.0
749,2020-11-27,Pickled fish powder,Sri Lanka,Taviuc Co Ltd,Histamine,240.0,mg/kg,HIS 12/2016,Risk,Not Applied,,,,,,,,,240.0
750,2020-12-04,Peanuts blanched,Brazil,Beatrice Comercio Importacao E Exportacao De Amendom Ltda,Aflatoxin,0.033,mg/kg,NUT 11/2018,Risk,Not Applied,,,,,,,,,0.033
751,2020-12-04,Peanuts flour coated,India,Jamnadas Ruttonsey and Company,Aflatoxin,0.22,mg/kg,NUT 11/2018,Risk,Not Applied,,,,,,,,,0.22
752,2020-12-04,Dried spanish mackerel,Sri Lanka,CMB Lanka (Private) Limited,Histamine,410.0,mg/kg,HIS 12/2016,Risk,Not Applied,,,,,,,,,410.0
753,2020-12-04,Dried spanish mackerel,Sri Lanka,CMB Lanka (Private) Limited,Histamine,920.0,mg/kg,HIS 12/2016,Risk,Not Applied,,,,,,,,,920.0
754,2020-12-07,Peanut/sesame paste,China,Beijing Wangzhihe Foodstuff Factory,Aflatoxin,,mg/kg,NUT 11/2018,Risk,Not Applied,,,,,,,,,
755,2020-12-07,Anchovy fillets in olive oil,Italy,Talatta SRL,Histamine,2150.0,mg/kg,HIS 12/2016,Risk,Not Applied,,,,,,,,,2150.0
756,2020-12-08,Anchovies,Italy,Delizie Di Calaeria,Histamine,310.0,mg/kg,HIS 12/2016,Risk,Not Applied,,,,,,,,,310.0
757,2020-12-08,Maldive fish chips,Sri Lanka,Derana Marketing Services Pvt Ltd,Histamine,250.0,mg/kg,HIS 12/2016,Risk,Not Applied,,,,,,,,,250.0
758,2020-12-09,Peanut chickee,Pakistan,Oasis Corporation,Aflatoxin,,mg/kg,NUT 11/2018,Risk,Not Applied,,,,,,,,,
759,2020-12-11,Dried anchovy,Myanmar,SHWE Myanmar Investment and Commercial Co Ltd,Histamine,360.0,mg/kg,HIS 12/2016,Risk,Not Applied,,,,,,,,,360.0
760,2020-12-15,Kelp powder,Republic of Korea,BKF Global,Iodine,4380.0,mg/kg,BSW 12/2016,Risk,Not Applied,,,,,,,,,4380.0
761,2020-12-17,Peeled and cooked cocktail prawns,Thailand,Thai Union Seafood Company Ltd,Vibrio cholerae,125.0,g,CRU 11/2020,Risk,Not Applied,,,,,,,,,1250000.0
762,2020-12-16,Canned tuna (tuna and onion),Thailand,ABD Khan Co Ltd,Histamine,455.0,mg/kg,HIS 12/2016,Risk,Not Applied,,,,,,,,,455.0
763,2020-12-16,Canned tuna (tomato and basil),Thailand,ABD Khan Co Ltd,Histamine,812.0,mg/kg,HIS 12/2016,Risk,Not Applied,,,,,,,,,812.0
764,2020-12-17,Seasoning peanuts fully cooked,China,Zhejiang Chenhua Co Ltd,Aflatoxin,0.192,mg/kg,HIS 11/2018,Risk,Not Applied,,,,,,,,,0.192
765,2020-12-17,Anchovy fillets,Italy,Talatta SRL,Histamine,330.0,mg/kg,HIS 12/2016,Risk,Not Applied,,,,,,,,,330.0
766,2020-12-18,Prepared fish (otsunami koago),Japan,Kojima Shokuhin Co Ltd,Histamine,250.0,mg/kg,HIS 12/2016,Risk,Not Applied,,,,,,,,,250.0
767,2020-12-22,Hijiki seaweed,Republic of Korea,BKF Global,Inorganic arsenic,80.3,mg/kg,HIS 10/2016,Risk,Not Applied,,,,,,,,,80.3
768,2020-12-24,Peanuts diced & blanched,China,AHCOF Industrial Development Co Ltd,Aflatoxin,0.06,mg/kg,NUT 11/2018,Risk,Not Applied,,,,,,,,,0.06
769,2020-12-30,Chilli powder,India,Synthite Industries Ltd,Salmonella,125.0,g,SPI 06/2019,Risk,Not Applied,,,,,,,,,1250000.0
770,2020-11-19,Fruit jelly,Malaysia,Tenten,Additive sodium benzoate (211),,none,FSC 1.3.1,Surveillance,Composition,16583,,,,,,,,
771,2020-12-01,Horseradish powdered,Japan,Kinjirushi Wasabi Co (Yokohama Japan),Vitamin C,,none,FSC 1.3.2,Surveillance,Composition,16579,,,,,,,,
772,2020-12-08,Custard cake one roll,Vietnam,Tan Tien Phat Food Manufacturer,Colour 131,,none,FSC 1.3.1,Surveillance,Composition,16609,,,,,,,,
773,2020-12-09,Betel nut,India,Shree Ram Exports,Areca catechu (Betel nut),,none,FSC 1.4.4,Surveillance,Composition,16605,,,,,,,,
774,2020-12-09,Frozen cut hyacinth beans,India,Vadilal Industries Ltd,Profenofos,,mg/kg,FSC 1.4.2,Surveillance,Fruit and vegetable residue screen,HO match 15664,,,,,,,,
775,2020-12-10,Rice,Thailand,C.P Intertrade Co Ltd,Lead,0.9,mg/kg,FSC 1.4.1,Surveillance,Lead,16613,,,,,,,,0.9
776,2020-12-10,Barramundi skin on,Indonesia,PT Iambeu Mina Utama,Nitrofurazone,,mg/kg,FSC 1.4.2,Surveillance,Chemical,16614,,,,,,,,
777,2020-12-11,Cereal original chips ahoy,United States,Smart & Final,Vitamin B5,,none,FSC 1.3.2,Surveillance,Composition,HO match 16208,,,,,,,,
778,2020-12-14,Raspberry juice concentrate,Canada,Pacific Coast Fruit Products Ltd,Fipronil,,mg/kg,FSC 1.4.2,Surveillance,Fruit and vegetable residue screen,16621,,,,,,,,
779,2020-12-15,Garlic shoots,China,Anqiu Artisan Agricultural Products Co Ltd,Thiabendazole,,mg/kg,FSC 1.4.2,Surveillance,Fruit and vegetable residue screen,16626,,,,,,,,
780,2020-12-22,Rice ball,Singapore,Tee Yih Jia Food Mfg Pte Ltd,Additive 127 (Erythrosine),,none,FSC 1.3.1,Surveillance,Composition,16649,,,,,,,,
781,2020-12-23,Fruit jam mixed,Republic of Korea,Hindustan Unilever Ltd,Vitamin B3,,none,FSC 1.3.2,Surveillance,Composition,16659,,,,,,,,
782,2020-12-23,Jelly,Republic of Korea,Orion Corporation,Additive colouring carthamus yellow,,none,FSC 1.3.1,Surveillance,Composition,16645,,,,,,,,
783,2020-12-23,Jelly,Republic of Korea,Orion Corporation,Additve colouring gardenia blue,,none,FSC 1.3.1,Surveillance,Composition,16645,,,,,,,,
784,2020-12-31,Coffee Nescafe roast ready to drink,Thailand,Quality Coffee Product Co Ltd,Caffeine,800.0,mg/l,FSC 2.6.4,Surveillance,Composition,16668,,,,,,,,800.0
785,2020-12-29,Areca catechu (Betel nut),India,Unique Fragrances,Prohibited plant,,none,FSC 1.4.4,Risk,Not Applied,,,,,,,,,
786,2021-01-05,Areca catechu (Betel nut),India,Kirti Impex,Prohibited plant,,none,FSC 1.4.4,Risk,Not Applied,,,,,,,,,
787,2021-01-06,Chilli powder,India,Meximport Food Win Se Rl,Salmonella,125.0,g,SPI 06/2019,Risk,Not Applied,,,,,,,,,1250000.0
788,2021-01-07,Dried kelp,Republic of Korea,Badamoolsan Fishing Union Corporation,Iodine,2660.0,mg/kg,BSW 12/2016,Risk,Not Applied,,,,,,,,,2660.0
789,2021-01-08,Dried seaweed,Republic of Korea,Badamoolsan Fishing Union Corporation,Iodine,4260.0,mg/kg,BSW 12/2016,Risk,Not Applied,,,,,,,,,4260.0
790,2021-01-08,Masala peanut,India,GRB Dairy Foods Pvt Ltd,Aflatoxin,,mg/kg,NUT 11/2018,Risk,Not Applied,,,,,,,,,
791,2021-01-08,Mild peanut salad dressing,Indonesia,PT Ambengan Jaya Berkat Sejahtera,Aflatoxin,0.9,mg/kg,NUT 11/2018,Risk,Not Applied,,,,,,,,,0.9
792,2021-01-08,Salad dressing,Indonesia,PT Berkat Rasa Fajarindo,Aflatoxin,,mg/kg,NUT 11/2018,Risk,Not Applied,,,,,,,,,
793,2021-01-08,Sate salad dressing,Indonesia,PT Berkat Rasa Fajarindo,Aflatoxin,,mg/kg,NUT 11/2018,Risk,Not Applied,,,,,,,,,
794,2021-01-15,Dry anchovy,Myanmar,Universal Cold Store (Yangon) Co Ltd,Histamine,440.0,mg/kg,HIS 12/2016,Risk,Not Applied,,,,,,,,,440.0
795,2021-01-18,Dried fish (seer),Sri Lanka,Derana Marketing Services Pvt Ltd,Histamine,280.0,mg/kg,HIS 12/2016,Risk,Not Applied,,,,,,,,,280.0
796,2021-01-19,Dried fish (seer),Sri Lanka,Enrich Tea & Food Exports Pvt Ltd,Histamine,370.0,mg/kg,HIS 12/2016,Risk,Not Applied,,,,,,,,,370.0
797,2021-01-19,Prophase kelp slices,China,Xianglan Deil Co Ltd,Iodine,2940.0,mg/kg,BSW 12/2016,Risk,Not Applied,,,,,,,,,2940.0
798,2021-01-21,Sichuan pepper powder,China,Canngzhou City Huahai Shunda Grain & Oil Seasoning Co Ltd,Salmonella,125.0,g,SPI 06/2019,Risk,Not Applied,,,,,,,,,1250000.0
799,2021-01-21,Peanut butter,Ghana,Praise Export Services Ltd,Aflatoxin,0.048,mg/kg,NUT 11/2018,Risk,Not Applied,,,,,,,,,0.048
800,2021-01-25,Oysters,Taiwan,Chen Xin Industrial Co Ltd,E. coli,,mpn/g,MOL 04/2017,Risk,Not Applied,,,,,,,,,
801,2021-01-27,Peanut Masala Crispy Indian Snack,India,Nilamel Exports,Aflatoxin,0.143,mg/kg,NUT 11/2018,Risk,Not Applied,,,,,,,,,0.143
802,2021-01-27,Peanuts,Thailand,Siam Moei Co Ltd,Aflatoxin,0.314,mg/kg,NUT 11/2018,Risk,Not Applied,,,,,,,,,0.314
803,2021-01-28,Oysters,Vietnam,Cong Ty Tnhh Thuy San Duc Thanh,E. coli,,mpn/g,MOL 04/2017,Risk,Not Applied,,,,,,,,,
804,2020-12-22,Fermented bean curd,China,Kaiping Guanghe Fermented Bean Curd Ltd,Bacillus cereus,,cfu/g,Imported Food Control Act section 3(2),Surveillance,Bacillus cereus,HO match 13975,,,,,,,,
805,2020-12-29,Mouth freshener,India,Dharampal Satyapal (India),Additive 127 (Erythrosine),,none,FSC 1.3.1,Surveillance,Composition,16681,,,,,,,,
806,2021-01-05,Dragon fruit,Vietnam,Goodlife Company Limited,Carbendazim,,mg/kg,FSC 1.4.2,Surveillance,Fruit and vegetable residue screen,16682,,,,,,,,
807,2021-01-05,,,,Cypermethrin,,mg/kg,FSC 1.4.2,Surveillance,Not Applied,16682,,,,,,,,
808,2021-01-05,,,,Iprodione,,mg/kg,FSC 1.4.2,Surveillance,Not Applied,16682,,,,,,,,
809,2021-01-05,,,,Permethrin,,mg/kg,FSC 1.4.2,Surveillance,Not Applied,16682,,,,,,,,
810,2021-01-06,Seasoned vinegar,Japan,Marukan Su Co Ltd,Additive colouring- carthamus yellow,,none,FSC 1.3.1,Surveillance,Composition,HO match 15822,,,,,,,,
811,2021-01-13,Speckled eggs confectionery,South Africa,Lode Stone Confectionary,Additive 127 (Erythrosine),,none,FSC 1.3.1,Surveillance,Composition,16691,,,,,,,,
812,2021-01-15,Celery diced,China,Yantai Aofeng Foodstuff Co Ltd,Procymidone,,mg/kg,FSC 1.4.2,Surveillance,Fruit and vegetable residue screen,16710,,,,,,,,
813,2021-01-15,Garlic shoots,China,Jining New Silk Road Food Co Ltd,Carbendazim,,mg/kg,FSC 1.4.2,Surveillance,Fruit and vegetable residue screen,HO match 16028,,,,,,,,
814,2021-01-15,Frozen blackcurrant concentrate,Italy,Iprona Spa,Carbendazim,,mg/kg,FSC 1.4.2,Surveillance,Fruit and vegetable residue screen,16696,,,,,,,,
815,2021-01-15,Frozen broccoli,China,Qingdao Oea Foods Co Ltd,Procymidone,,mg/kg,FSC 1.4.2,Surveillance,Fruit and vegetable residue screen,16702,,,,,,,,
816,2021-01-15,Fresh lemons,Egypt,Orange for Agricultural Crops,Indoxacarb,,mg/kg,FSC 1.4.2,Surveillance,Fruit and vegetable residue screen,16705,,,,,,,,
817,2021-01-18,Fresh betel leaves line 1a,India,SPN Exports,Carbendazim,,mg/kg,FSC 1.4.2,Surveillance,Fruit and vegetable residue screen,16715,,,,,,,,
818,2021-01-18,,,,Profenofos,,mg/kg,FSC 1.4.2,Surveillance,Not Applied,16715,,,,,,,,
819,2021-01-18,Fresh betel leaves  line 1b,India,SPN Exports,Carbendazim,,mg/kg,FSC 1.4.2,Surveillance,Fruit and vegetable residue screen,16715,,,,,,,,
820,2021-01-18,,,,Chlorpyrifos,,mg/kg,FSC 1.4.2,Surveillance,Not Applied,16715,,,,,,,,
821,2021-01-18,,,,Fipronil,,mg/kg,FSC 1.4.2,Surveillance,Not Applied,16715,,,,,,,,
822,2021-01-18,,,,Metalaxyl,,mg/kg,FSC 1.4.2,Surveillance,Not Applied,16715,,,,,,,,
823,2021-01-20,Precooked maize meal,Namibia,Namib Mills Pty Ltd,Vitamin A,,none,FSC 1.3.2,Surveillance,Composition,16709,,,,,,,,
824,2021-01-20,,,,Selenium,,none,FSC 1.3.2,Surveillance,Not Applied,16709,,,,,,,,
825,2021-01-20,,,,Pantothenic acid,,none,FSC 1.3.2,Surveillance,Not Applied,16709,,,,,,,,
826,2021-01-20,,,,Vitamin B1,,none,FSC 1.3.2,Surveillance,Not Applied,16709,,,,,,,,
827,2021-01-21,Cocoa Powder,Japan,Morinaga Co Ltd,Niacin,,none,FSC 1.3.2,Surveillance,Composition,16709,,,,,,,,
828,2021-01-22,Macaroni,Philippines,RFM Corporation (Philippines),Vitamin A,,none,FSC 1.3.2,Surveillance,Composition,HO match 15661,,,,,,,,
829,2021-01-29,Frozen red chilli  line 7a,Vietnam,Saka Saka Company Limited,Chlorpyrifos,,mg/kg,FSC 1.4.2,Surveillance,Chemical,HO match 13894,,,,,,,,
830,2021-01-29,,,,Acephate,,mg/kg,FSC 1.4.2,Surveillance,Not Applied,HO match 13894,,,,,,,,
831,2021-01-29,,,,Carbendazim,,mg/kg,FSC 1.4.2,Surveillance,Not Applied,HO match 13894,,,,,,,,
832,2021-01-29,Frozen red chilli  line 8a,Vietnam,Saka Saka Company Limited,Difenocol,,mg/kg,FSC 1.4.2,Surveillance,Chemical,HO match 13894,,,,,,,,
833,2021-02-05,Peanut sauce - long chim miang base,Thailand,Aaharn Thai Foods Co Ltd,Aflatoxin,,mg/kg,NUT 11/2018,Risk,Not Applied,,,,,,,,,
834,2021-02-05,Peanuts granulated,China,Shandong Fengsheng Foods Co Ltd (Shandong China),Aflatoxin,0.088,mg/kg,NUT 11/2018,Risk,Not Applied,,,,,,,,,0.088
835,2021-02-17,Sesame seed hulled,India,Patidar Exports Pvt Ltd,Salmonella,125.0,g,SES 05/2014,Risk,Not Applied,,,,,,,,,1250000.0
836,2021-02-19,Maldive fish,Sri Lanka,Lakrasa Products Pvt Ltd,Histamine,320.0,mg/kg,HIS 12/2016,Risk,Not Applied,,,,,,,,,320.0
837,2021-02-26,Fresh tuna,Japan,Global View Co Ltd,Histamine,1106.0,mg/kg,HIS 12/2016,Risk,Not Applied,,,,,,,,,1106.0
838,2021-01-25,Chilli,Papua New Guinea,Nolka Limited,Cyhalothrin,,mg/kg,FSC 1.4.2,Surveillance,Fruit and vegetable residue screen,16752,,,,,,,,
839,2021-01-29,Barramundi skin on,Indonesia,PT Iambeu Mina Utama,Enrofloxacin,,mg/kg,FSC 1.4.2,Surveillance,Fruit and vegetable residue screen,HO match 16614,,,,,,,,
840,2021-02-01,Dried fig,United Arab Emirates,PDS (FZE),Cypermethrin,,mg/kg,FSC 1.4.2,Surveillance,Fruit and vegetable residue screen,16759,,,,,,,,
841,2021-02-03,Herbal syrup Hamdard Joshanda,India,Hamdard Laboratories,Borago officinalis (Borage),,none,FSC 1.4.4,Surveillance,Composition,16758,,,,,,,,
842,2021-02-03,Fruit cake rusk,India,Bikanervala Foods Pvt Ltd,Additive 127 (Erythrosine),,none,FSC 1.3.1,Surveillance,Composition,HO match 16477,,,,,,,,
843,2021-02-08,Dried longan,China,Guangzhou Meixiang Yang Catering Management Co Ltd,Carbendazim,,mg/kg,FSC 1.4.2,Surveillance,Fruit and vegetable residue screen,16772,,,,,,,,
844,2021-02-08,Coconut shredded,India,Wholesome Foods,Salmonella,125.0,g,FSC 1.6.1,Surveillance,Microbiological,16773,,,,,,,,1250000.0
845,2021-02-08,Goraka fruit,Sri Lanka,Jayalanka Supplier,2-Phenylphenol,,mg/kg,FSC 1.4.2,Surveillance,Fruit and vegetable residue screen,16775,,,,,,,,
846,2021-02-08,Tipi tip onion snack,Sri Lanka,Uswatte Confectionary,Additive Phosphorus,,none,FSC 1.3.1,Surveillance,Composition,16776,,,,,,,,
847,2021-02-08,Instant noodles,China,Pingshan Xiangxuanyuan Food Co Ltd,Vitamin E,,none,FSC 1.3.2,Surveillance,Composition,16778,,,,,,,,
848,2021-02-09,Frozen yam,Tonga,JM Exports,Acephate,,mg/kg,FSC 1.4.2,Surveillance,Fruit and vegetable residue screen,16769,,,,,,,,
849,2021-02-10,Red bull drink,Thailand,T.C. Pharmaceutical Industries Co Ltd,Choline,,none,FSC 1.3.2,Surveillance,Composition,16787,,,,,,,,
850,2021-02-11,Parval,India,Innovative Cuisine,Monocrotophos,,mg/kg,FSC 1.4.2,Surveillance,Fruit and vegetable residue screen,16840,,,,,,,,
851,2021-02-15,Black olives manzanillo,Israel,Kvuzat Yavne,Ferrous Sulphate,,none,FSC 1.3.2,Surveillance,Composition,16788,,,,,,,,
852,2021-02-16,Cambodge tamarind fruit,India,Eastern Condiments Pvt Ltd,2-Phenylphenol,,mg/kg,FSC 1.4.2,Surveillance,Fruit and vegetable residue screen,16807,,,,,,,,
853,2021-02-17,Fresh betel leaves,India,Thangapandi International,Carbendazim,,mg/kg,FSC 1.4.2,Surveillance,Fruit and vegetable residue screen,HO match 15619,,,,,,,,
854,2021-02-17,Fresh betel leaves,India,Thangapandi International,Chlorpyrifos,,mg/kg,FSC 1.4.2,Surveillance,Fruit and vegetable residue screen,HO match 15619,,,,,,,,
855,2021-02-17,Fresh betel leaves,India,Thangapandi International,Fipronil,,mg/kg,FSC 1.4.2,Surveillance,Fruit and vegetable residue screen,HO match 15619,,,,,,,,
856,2021-02-17,Fresh betel leaves,India,Thangapandi International,Cypermethrin,,mg/kg,FSC 1.4.2,Surveillance,Fruit and vegetable residue screen,HO match 15619,,,,,,,,
857,2021-02-17,Fresh betel leaves,India,Thangapandi International,Profenofos,,mg/kg,FSC 1.4.2,Surveillance,Fruit and vegetable residue screen,HO match 15619,,,,,,,,
858,2021-02-17,Mixed fruit jam,India,Sunrise Chemicals,Vitamin B3,,none,FSC 1.3.2,Surveillance,Composition,16812,,,,,,,,
859,2021-02-18,Cream crackers,Malaysia,Kraft Malaysia Sdn Bhd,Vitamin B1,,none,FSC 1.3.2,Surveillance,Composition,HO match 16563,,,,,,,,
860,2021-02-18,Cream crackers,Malaysia,Kraft Malaysia Sdn Bhd,Vitamin A,,none,FSC 1.3.2,Surveillance,Composition,HO match 16563,,,,,,,,
861,2021-02-18,Cream crackers,Malaysia,Kraft Malaysia Sdn Bhd,Iodine,,none,FSC 1.3.2,Surveillance,Composition,HO match 16563,,,,,,,,
862,2021-02-22,Cereal bars,United Kingdom,Tesco Pty Ltd,Vitamin B1,,none,FSC 1.3.2,Surveillance,Composition,16818,,,,,,,,
863,2021-02-22,Cereal bars,United Kingdom,Tesco Pty Ltd,Pantothenic acid,,none,FSC 1.3.2,Surveillance,Composition,16818,,,,,,,,
864,2021-02-24,"Jelly powder
",Malaysia,Happy Grass Products Sdn Bhd,Additive 127 (Erythrosine),,none,FSC 1.3.1,Surveillance,Composition,16798,,,,,,,,
865,2021-03-02,Cheese (bontazola vaschetta gorgonzola D.O.P),Italy,Emilio Mauri,Listeria,,none,FSC 1.6.1,Risk,Not Applied,,,,,,,,,
866,2021-03-02,Chilli powder,India,Nishant Export,Salmonella,125.0,g,SPI 06/2019,Risk,Not Applied,,,,,,,,,1250000.0
867,2021-03-03,Frozen cockle,Vietnam,Taviuc Co Ltd,E. coli,,mpn/g,MOL 04/2017,Risk,Not Applied,,,,,,,,,
868,2021-03-08,Peanut candy,India,Thulasi Exim International,Aflatoxin,,mg/kg,NUT 11/2018,Risk,Not Applied,,,,,,,,,
869,2021-03-10,Egg coated peanuts,Indonesia,PT Selaras Jaya Aneka Globalindo,Aflatoxin,,mg/kg,NUT 11/2018,Risk,Not Applied,,,,,,,,,
870,2021-03-11,Tapioca chips,India,Greenmount Spices,Hydrocyanic acid,15.0,mg/kg,CAS 09/2019,Risk,Not Applied,,,,,,,,,15.0
871,2021-03-12,Peanut satay sauce chicken,Indonesia,PT Enak Jaya Makmur (Indonesia),Aflatoxin,,mg/kg,NUT 11/2018,Risk,Not Applied,,,,,,,,,
872,2021-03-12,Spicy peanut salad dressing,Indonesia,PT Enak Jaya Makmur (Indonesia),Aflatoxin,,mg/kg,NUT 11/2018,Risk,Not Applied,,,,,,,,,
873,2021-03-15,Dried Seaweed,China,Jinqiang Food Factory,Iodine,,mg/kg,BSW 12/2016,Risk,Not Applied,,,,,,,,,
874,2021-03-15,Dried Seaweed,China,Jinqiang Food Factory,Iodine,,mg/kg,BSW 12/2016,Risk,Not Applied,,,,,,,,,
875,2021-03-15,Dried Seaweed,China,Jinqiang Food Factory,Iodine,,mg/kg,BSW 12/2016,Risk,Not Applied,,,,,,,,,
876,2021-03-16,Mussels,Fiji,Fiji Agro Marketing,E. coli,,mpn/g,MOL 04/2017,Risk,Not Applied,,,,,,,,,
877,2021-03-19,Betel nut,Myanmar,Evershine Trading Co Ltd,Prohibited plant,,none,FSC 1.4.4,Risk,Not Applied,,,,,,,,,
878,2021-03-23,Peanut bars/balls,India,Visnukumar (India),Aflatoxin,,mg/kg,NUT 11/2018,Risk,Not Applied,,,,,,,,,
879,2021-02-23,Soft drink,Japan,Asahi Inryo K.K,Vitamin C,,none,FSC 1.3.2,Surveillance,Composition,16856,,,,,,,,
880,2021-02-26,Energy drink,Thailand,T.C Pharmaceutical Industries Co Ltd,Choline Bitrate,,none,FSC 1.3.2,Surveillance,Composition,HO match 16586,,,,,,,,
881,2021-03-02,Celery,China,Yantai Aofeng Foodstuff Co Ltd,Cyhalothrin,,mg/kg,FSC 1.4.2,Surveillance,Fruit and vegetable residue screen,HO match 16710,,,,,,,,
882,2021-03-02,Spinach,India,Global Gourmet Pvt Ltd,Chlorpyrifos,,mg/kg,FSC 1.4.2,Surveillance,Fruit and vegetable residue screen,HO match 15422,,,,,,,,
883,2021-03-02,Preserved chilli beancurd,China,Zhuhai Bomen Food Enterprises Ltd,Bacillus cereus,,cfu/g,FSC 1.6.1,Surveillance,Bacillus cereus,16893,,,,,,,,
884,2021-03-05,Yellow lentils,India,Batra Enterprises,Chlorpyrifos,,mg/kg,FSC 1.4.2,Surveillance,Fruit and vegetable residue screen,HO match 16116,,,,,,,,
885,2021-03-11,Frozen vegetables,India,Aerath Business Corporation,Acephate,,mg/kg,FSC 1.4.2,Surveillance,Fruit and vegetable residue screen,16871,,,,,,,,
886,2021-03-11,Frozen vegetables,India,Aerath Business Corporation,Methamidophos Lines 5a&5b,,mg/kg,FSC 1.4.2,Surveillance,Fruit and vegetable residue screen,16871,,,,,,,,
887,2021-03-11,Frozen vegetables,India,Aerath Business Corporation,Cypermethrin,,mg/kg,FSC 1.4.2,Surveillance,Fruit and vegetable residue screen,16871,,,,,,,,
888,2021-03-11,Frozen vegetables,India,Aerath Business Corporation,Cypermethrin,,mg/kg,FSC 1.4.2,Surveillance,Fruit and vegetable residue screen,16871,,,,,,,,
889,2021-03-16,Raisins,Islamic Replubic of Iran,Ratin Khosh Co,Carbendazim,,mg/kg,FSC 1.4.2,Surveillance,Fruit and vegetable residue screen,16885,,,,,,,,
890,2021-03-16,Mandarins,Eqypt,Dakahlia,Pendimethalin,,mg/kg,FSC 1.4.2,Surveillance,Fruit and vegetable residue screen,16886,,,,,,,,
891,2021-03-18,Monkfruit,China,Success Day Hong,Cyhalothrin,,mg/kg,FSC 1.4.2,Surveillance,Fruit and vegetable residue screen,HO match 15256,,,,,,,,
892,2021-03-18,Lentils,Myanmar,AYS MFG Co Ltd,Chlorpyrifos,,mg/kg,FSC 1.4.2,Surveillance,Fruit and vegetable residue screen,HO match 15007,,,,,,,,
893,2021-03-18,Yellow lentils,Myanmar,AYS MFG Co Ltd,Chlorpyrifos,,mg/kg,FSC 1.4.2,Surveillance,Fruit and vegetable residue screen,HO match 15323,,,,,,,,
894,2021-03-19,Chocolate and caramel cereal bars,United Kingdom,Tesco Pty Ltd,Vitamin B1,,none,FSC 1.3.2,Surveillance,Composition,HO match 16818,,,,,,,,
895,2021-03-19,Chocolate and caramel cereal bars,United Kingdom,Tesco Pty Ltd,Pantothenic acid,,none,FSC 1.3.2,Surveillance,Composition,HO match 16818,,,,,,,,
896,2021-03-19,Potato chips,China,Hunan Wangwang Foodstuffs Co Ltd,Vitamin C,,none,FSC 1.3.2,Surveillance,Composition,HO match 16641,,,,,,,,
897,2021-03-18,Betel nut,India,Visnukumar Traders Pvt Ltd,Prohibited plant,,none,FSC 1.4.4,Risk,Not Applied,,,,,,,,,
898,2021-04-09,Tapioca crisp,Malaysia,Desa Southern Agency,Hydrocyanic acid,11.0,mg/kg,CAS 09/2016,Risk,Not Applied,,,,,,,,,11.0
899,2021-04-13,Cassava chips,Indonesia,PT Rasa Sayang Ais Krim,Hydrocyanic acid,11.0,mg/kg,CAS 09/2016,Risk,Not Applied,,,,,,,,,11.0
900,2021-04-13,Roasted peanuts,China,Shandong Fengsheng Foods Co Ltd,Aflatoxin,0.149,mg/kg,NUT 11/2018,Risk,Not Applied,,,,,,,,,0.149
901,2021-04-14,Tapioca chips,Indonesia,Wynad Exports,Hydrocyanic acid,14.0,mg/kg,CAS 09/2016,Risk,Not Applied,,,,,,,,,14.0
902,2021-04-14,Tapioca sticks,Indonesia,Wynad Exports,Hydrocyanic acid,18.0,mg/kg,CAS 09/2016,Risk,Not Applied,,,,,,,,,18.0
903,2021-04-15,Dried seaweed strip,China,Fuzhou Hailin Foods Co Ltd,Iodine,1830.0,mg/kg,BSW 12/2016,Risk,Not Applied,,,,,,,,,1830.0
904,2021-04-15,Dried seaweed,China,Fuzhou Hailin Foods Co Ltd,Iodine,2900.0,mg/kg,BSW 12/2016,Risk,Not Applied,,,,,,,,,2900.0
905,2021-04-23,Peanuts granulated,China,Shandong Fengsheng Foods Co Ltd,Aflatoxin,0.032,mg/kg,NUT 11/2018,Risk,Not Applied,,,,,,,,,0.032
906,2021-04-24,Sweet peanuts,Sri Lanka,J Remitta Stores,Aflatoxin,,mg/kg,NUT 11/2018,Risk,Not Applied,,,,,,,,,
907,2021-04-30,Red chilli powder,India,Al Saqr General Trading Co Llc,Salmonella,125.0,g,SPI 06/2019,Risk,Not Applied,,,,,,,,,1250000.0
908,2021-03-19,Candy,Japan,Kasugai Seika Co Ltd,Gardenia blue,,none,FSC 1.3.1,Surveillance,Composition,16956,,,,,,,,
909,2021-04-01,Raisin sultana,India,Patidar Exports Pvt Ltd,Thiamethoxam,,mg/kg,FSC 1.4.2,Surveillance,Fruit and vegetable residue screen,16944,,,,,,,,
910,2021-04-07,Spinach,China,Gaomi Ruifeng Foods Co,Cyhalothrin,,mg/kg,FSC 1.4.2,Surveillance,Fruit and vegetable residue screen,16945,,,,,,,,
911,2021-04-07,Spinach,China,Gaomi Ruifeng Foods Co,Chlorpyrifos,,mg/kg,FSC 1.4.2,Surveillance,Fruit and vegetable residue screen,16945,,,,,,,,
912,2021-04-14,Snow peas,China,Yongzhou Huiyou Agriculture Development Limited Company,Thiamethoxam,,mg/kg,FSC 1.4.2,Surveillance,Fruit and vegetable residue screen,16960,,,,,,,,
913,2021-04-14,Snow peas,China,Yongzhou Huiyou Agriculture Development Limited Company,Difenoconazole,,mg/kg,FSC 1.4.2,Surveillance,Fruit and vegetable residue screen,16960,,,,,,,,
914,2021-04-20,Raisins,India,Patidar Exports Pvt Ltd,Carbendazim,,mg/kg,FSC 1.4.2,Surveillance,Fruit and vegetable residue screen,16981,,,,,,,,
915,2021-04-23,Gourd slices,India,Innovative cuisine,Monocrotophos,,mg/kg,FSC 1.4.2,Surveillance,Fruit and vegetable residue screen,HO match 16840,,,,,,,,
